{
  "schemaVersion": 2,
  "rowId": "cloudvault.search",
  "authorityGeneration": 2,
  "transition": "promotion",
  "status": "active",
  "evidence": [
    "https://github.com/Imagine-That-Ai/BurnBar/attestations/38001476"
  ],
  "approvedBy": "@Ajnunezg",
  "approvedAt": "2026-07-30T16:26:09Z",
  "commit": "b270370e2615a7b20e2979e62d696d3cee293972",
  "promotionAttestation": {
    "path": "config/domain-core-promotion-attestations/cloudvault-search/2.json",
    "sha256": "1ba45a767fdf0987e9018b266e815dbc1db886c6801236eb71355a45104713b5",
    "supersedes": {
      "transition": "annulment",
      "path": "config/domain-core-legacy-deletion-receipts/cloudvault.search/1/annulment.json",
      "sha256": "2086b4433902a7fde4ca15e9403e87f4d4fdf7bbd6dcfe382059aad8fb85e220"
    }
  }
}
